"Status","Start Time","Stop Time","Duration in ms","Parent Suite","Suite","Sub Suite","Test Class","Test Method","Name","Description"
"passed","Mon Feb 12 17:54:55 GMT 2024","Mon Feb 12 17:55:07 GMT 2024","12310","Dragon Tests","Smoke tests","tests.FlashcardsLogicTest","tests.FlashcardsLogicTest","testYes4Kinda2No2Logic","TC1393-1396-1400 - В 'Show all flashcards'/'Yes/Kinda/No' отображается отмеченная карточка.","LMS-1393 Логика Yes 4. https://app.qase.io/plan/LMS/1?case=1393LMS-1396 Логика Kinda 2. https://app.qase.io/plan/LMS/1?case=1396LMS-1400 Логика No 2. https://app.qase.io/plan/LMS/1?case=1400Нажать 'Yes/Kinda/No'. В 'Show all flashcards'/'Yes/Kinda/No' отображается отмеченная карточка."
"passed","Mon Feb 12 17:49:50 GMT 2024","Mon Feb 12 17:49:50 GMT 2024","967","Dragon Tests","Smoke tests","tests.NewCustomerStreaksTest","tests.NewCustomerStreaksTest","testStreaksModalWindowIsAppeared","TC1343-01 - Verification “Streaks” modal window appears.","LMS-1343 Отработка streaks. https://app.qase.io/plan/LMS/1?case=1343   Objective: To verify that the modal window will be opened after clicking on the “Streaks” button."
"passed","Mon Feb 12 18:07:05 GMT 2024","Mon Feb 12 18:07:11 GMT 2024","5929","Dragon Tests","Smoke tests","tests.TestTutorTest","tests.TestTutorTest","testUserCanSeeTheRightAnswerAndTheExplanation","TC1348-01 User can see the right answer and the explanation.","LMS-1348 Видимость для юзера ответа. https://app.qase.io/case/LMS-1348Objective: To ensure that the user can view the correct answer highlighted in greenand an explanation provided below the answer choices."
"passed","Mon Feb 12 18:07:16 GMT 2024","Mon Feb 12 18:07:45 GMT 2024","28493","Dragon Tests","Smoke tests","tests.TestTutorTest","tests.TestTutorTest","testUserIsAbleToRetrieveTestResults","TC1352-01 Verify the user is able to retrieve test results.","LMS-1352 Возможность получать результаты. https://app.qase.io/project/LMS?suite=179&case=1352   Objective: To confirm that users can access their test results successfully."
"passed","Mon Feb 12 17:51:44 GMT 2024","Mon Feb 12 17:51:51 GMT 2024","7348","Dragon Tests","Smoke tests","tests.FlashcardPacksTest","tests.FlashcardPacksTest","testFlashCardTurnedAfterClickingShowAnswerButton","TC1368-01 - Flashcard turned when clicking the “Show Answer” button.","LMS-1368 Возможность оставлять пометки yes. https://app.qase.io/plan/LMS/1?case=1368  Objective: Verify that the user can see the Answer when the flashcard is turned."
"passed","Mon Feb 12 18:00:53 GMT 2024","Mon Feb 12 18:01:27 GMT 2024","34177","Dragon Tests","Smoke tests","tests.PerformanceTest","tests.PerformanceTest","testDisplayingStatisticsForAllFlashcards","TC1357-01 - Displaying Statistics for All Flashcards.","LMS-1357 Получение статистики по стопкам. https://app.qase.io/plan/LMS/1?case=1357   Objective: To confirm the accurate display of statistics for all flashcards in the Performance section."
"passed","Mon Feb 12 17:59:45 GMT 2024","Mon Feb 12 18:00:23 GMT 2024","37960","Dragon Tests","Smoke tests","tests.PaymentTest","tests.PaymentTest","testE2EPurchaseLifeTimeCourse","TC1359-06 - Submitting Payment with Valid Credit Card",""
"passed","Mon Feb 12 18:00:28 GMT 2024","Mon Feb 12 18:00:30 GMT 2024","2249","Dragon Tests","Smoke tests","tests.PaymentTest","tests.PaymentTest","testOpenChooseAProductModalByClickAGetButton","TC1359-03 - Opening the 'Choose a Product' Modal by Clicking 'Get' Button”.",""
"passed","Mon Feb 12 17:55:13 GMT 2024","Mon Feb 12 17:55:26 GMT 2024","12804","Dragon Tests","Smoke tests","tests.FlashcardsLogicTest","tests.FlashcardsLogicTest","testYes4Kinda2No2Logic","TC1393-1396-1400 - В 'Show all flashcards'/'Yes/Kinda/No' отображается отмеченная карточка.","LMS-1393 Логика Yes 4. https://app.qase.io/plan/LMS/1?case=1393LMS-1396 Логика Kinda 2. https://app.qase.io/plan/LMS/1?case=1396LMS-1400 Логика No 2. https://app.qase.io/plan/LMS/1?case=1400Нажать 'Yes/Kinda/No'. В 'Show all flashcards'/'Yes/Kinda/No' отображается отмеченная карточка."
"passed","Mon Feb 12 18:02:14 GMT 2024","Mon Feb 12 18:02:17 GMT 2024","2623","Dragon Tests","Smoke tests","tests.SearchTest","tests.SearchTest","testSearchByNotExistingWord","TC1361-01 - Typing of not found text gives 'Nothing found. Try to use other keywords' message.","LMS-1361 Поиск по конкретному слову. https://app.qase.io/plan/LMS/1?case=1361Objective: To confirm the display of the 'Nothing found. Try to use other keywords' message when a non-existent keyword is typed."
"passed","Mon Feb 12 18:02:50 GMT 2024","Mon Feb 12 18:02:53 GMT 2024","2812","Dragon Tests","Smoke tests","tests.StudyGuideTest","tests.StudyGuideTest","testExecutingWordHighlightingByDoubleClick","TC1363-01 - Executing Word Highlighting by Double Click","LMS-1363 Выделение части текста. https://app.qase.io/case/LMS-1363   To confirm the user's ability to successfully highlight a word"
